{
  "schema_version": "1.0",
  "milestone_id": "M-06",
  "source_task_id": "/root",
  "parent_task_id": "019f52e6-c282-7750-a993-1879bf0b2613",
  "event_id": "m06-f11-contract-correction-capability-blocker-20260713-01",
  "sequence": 1,
  "event_type": "blocker",
  "dispatch_id": "m06-f11-contract-correction-20260713-01",
  "work_item_id": "F-11-contract-correction",
  "base_sha": "ecde26f5de3a5676ca536ba3db9849d848367216",
  "commit_or_frozen_sha": null,
  "emitted_at": "2026-07-13T13:01:24-03:00",
  "callback_due_at": "2026-07-13T13:01:24-03:00",
  "status": "needs_input",
  "checkpoint_id": "M06-F11-COR-NEEDS-INPUT-001",
  "commit": null,
  "changed_paths": [
    ".mnfs/MIS-001-mercado-livre-operating-cockpit/M-06-orders-margin-ml/_dispatch/m06-f11-contract-correction-needs-input-20260713.json"
  ],
  "evidence": [
    ".mnfs/MIS-001-mercado-livre-operating-cockpit/M-06-orders-margin-ml/F-11-sankhya-linkage-read-contract/spec.md",
    ".mnfs/MIS-001-mercado-livre-operating-cockpit/M-06-orders-margin-ml/F-11-sankhya-linkage-read-contract/plan.md",
    "apps/server_core/internal/modules/internal_read/adapters/oracle/sankhya_linkage_reader.go",
    ".mnfs/MIS-001-mercado-livre-operating-cockpit/M-06-orders-margin-ml/corrections/correction-task.md"
  ],
  "review": null,
  "blockers": [
    "F-11 contradicts the accepted Oracle fact: it requires VARCHAR2/NVARCHAR2 and ml:v1: external keys, but AD_NUMPEDIDO_ECOM is a nullable CLOB whose exact supported lookup key is the pure number 2000017276984774.",
    "The harness requires this coherent correction to be dispatched only to the configured mpc-implementer custom agent. The active task exposes no native custom-agent dispatch control, so the Milestone cannot truthfully dispatch or substitute a default child.",
    "M-06-C03 remains deliberately deferred/failing because no trusted-principal authorization boundary is evidenced; the two recorded correction attempts are exhausted. This checkpoint does not waive it.",
    "TOP 306 absence is expected and has not been investigated. Candidate A has not been reissued."
  ],
  "next": "Enable native dispatch of the configured mpc-implementer, then preflight and dispatch one F-11 contract correction that accepts nullable CLOB metadata, validates a nonblank digits-only order key, and uses an exact parameterized CLOB comparison while preserving MPC tenant/provider/installation ownership and explicit ambiguity. After its single commit, freeze one SHA, request one mpc-verifier review, then proportional mpc-verifier QA; QA must retain M-06-C03 as failing unless separately authorized evidence changes it."
}
