{
  "schema_version": "1.0",
  "milestone_id": "M-06",
  "source_task_id": "/root",
  "parent_task_id": "019f5c6b-db41-7922-80e0-48feb1f0f11c",
  "event_id": "m06-terminal-handoff-20260713-01",
  "sequence": 4,
  "event_type": "terminal_handoff",
  "dispatch_id": "m06-f11-contract-correction-20260713-02",
  "work_item_id": "F-11-contract-correction",
  "base_sha": "0cfa801b7f9cfe57c0cd81f7c953e81a8a706cbf",
  "commit_or_frozen_sha": "1eb8831fb1d0d1b84f4d1325978bbc4f76c9ed0f",
  "emitted_at": "2026-07-13T16:30:00-03:00",
  "callback_due_at": "2026-07-13T16:30:00-03:00",
  "status": "failed",
  "checkpoint_id": "M06-F11-TERMINAL-20260713-01",
  "commit": "1eb8831fb1d0d1b84f4d1325978bbc4f76c9ed0f",
  "changed_paths": [
    ".mnfs/MIS-001-mercado-livre-operating-cockpit/M-06-orders-margin-ml/F-11-sankhya-linkage-read-contract",
    "apps/server_core/internal/modules/internal_read/adapters/oracle/sankhya_linkage_reader.go",
    "apps/server_core/internal/modules/internal_read/adapters/oracle/sankhya_linkage_reader_test.go",
    "apps/server_core/internal/modules/internal_read/application/sankhya_linkage_service_test.go",
    ".mnfs/MIS-001-mercado-livre-operating-cockpit/M-06-orders-margin-ml/validation-result.md"
  ],
  "evidence": [
    ".mnfs/MIS-001-mercado-livre-operating-cockpit/M-06-orders-margin-ml/F-11-sankhya-linkage-read-contract/validation.md",
    ".mnfs/MIS-001-mercado-livre-operating-cockpit/M-06-orders-margin-ml/F-07-order-specific-tax-provenance/validation.md",
    ".mnfs/MIS-001-mercado-livre-operating-cockpit/M-06-orders-margin-ml/F-15-partial-tax-snapshot-quality/validation.md",
    ".mnfs/MIS-001-mercado-livre-operating-cockpit/M-06-orders-margin-ml/validation-result.md"
  ],
  "review": {
    "verdict": "passed",
    "frozen_sha": "1eb8831fb1d0d1b84f4d1325978bbc4f76c9ed0f",
    "range": "0cfa801b7f9cfe57c0cd81f7c953e81a8a706cbf..1eb8831fb1d0d1b84f4d1325978bbc4f76c9ed0f",
    "fiscal_correction_43477850_included": true
  },
  "blockers": [
    "M-06-C03 remains deliberately failed/deferred: no trusted-principal and tenant/installation/order/item authorization boundary is proven; production writes must not be described as authenticated.",
    "Proportional QA could not independently verify C01/C02 under its registered Go command: supplied paths were absent and relative GOCACHE is invalid in Windows PowerShell."
  ],
  "next": "Portfolio must validate this checkpoint, retain M-06 as failed, and obtain explicit human authority before any further correction; the next authorized scope must establish C03 and repair the QA command contract before a new frozen-SHA review and QA."
}
