{
  "schema_version": "1.0",
  "milestone_id": "M-07",
  "source_task_id": "milestone-task",
  "parent_task_id": "portfolio-task",
  "event_id": "evt-0002",
  "sequence": 2,
  "event_type": "packet_accepted",
  "dispatch_id": "dispatch-m07",
  "work_item_id": "M-07",
  "base_sha": "b37a3da4e054579d6c220712300eaed0b86fd8cc",
  "commit_or_frozen_sha": null,
  "emitted_at": "2026-07-12T12:00:00Z",
  "callback_due_at": "2026-07-12T12:10:00Z",
  "status": "accepted",
  "checkpoint_id": "cp-0002",
  "commit": null,
  "changed_paths": [],
  "evidence": ["packet accepted"],
  "review": null,
  "blockers": [],
  "next": "publish visible plan"
}
