{
  "schema_version": "1.0",
  "milestone_id": "M-07",
  "source_task_id": "portfolio-task",
  "parent_task_id": "portfolio-task",
  "event_id": "evt-heartbeat-1",
  "sequence": 3,
  "event_type": "heartbeat",
  "dispatch_id": "dispatch-m07",
  "work_item_id": "M-07",
  "base_sha": "b37a3da4e054579d6c220712300eaed0b86fd8cc",
  "commit_or_frozen_sha": null,
  "emitted_at": "2026-07-12T12:09:59Z",
  "callback_due_at": "2026-07-12T12:10:00Z",
  "status": "checking overdue callback",
  "checkpoint_id": "cp-heartbeat-1",
  "commit": null,
  "changed_paths": [],
  "evidence": [],
  "review": null,
  "blockers": [],
  "next": "request compact status"
}
